title,publisher,article_text,category,bias_label,url,published_date,topic_id
Climate Agenda Threatens American Energy Independence,Breitbart,"The latest climate summit produced yet another round of unrealistic emission targets that threaten to undermine American energy independence and economic competitiveness. The proposed 40% emission cuts would devastate the oil, gas, and coal industries that employ millions of Americans and provide affordable energy. Climate activists continue to push draconian regulations based on models that have consistently overestimated warming. Meanwhile, China and India have made only token commitments while expanding their own fossil fuel production. American families cannot afford the higher energy prices that these climate policies would inevitably produce.",ENVIRONMENT,Right,https://www.breitbart.com/politics/climate-energy-independence,2024-01-17,climate_policy
Climate Talks Conclude With New Emission Reduction Framework,BBC,"International climate negotiations concluded with 195 nations agreeing to a new framework for reducing greenhouse gas emissions over the next decade. The agreement sets a collective target of 40% emission reductions by 2035 from 2019 levels, with individual country plans to be submitted within six months. The framework includes new transparency mechanisms for tracking progress and a dispute resolution process for non-compliance. Scientific assessments indicate the targets are below what is needed to limit warming to 1.5°C but represent the most ambitious multilateral commitment to date. Financial pledges for developing nations totaled $128 billion, short of the $300 billion requested.",ENVIRONMENT,Center,https://www.bbc.com/news/climate-emission-framework,2024-01-17,climate_policy
"Climate Crisis Demands Radical Action, Not Half Measures",The Guardian,"The climate summit's tepid emission targets are a betrayal of future generations. While world leaders pat themselves on the back for agreeing to a 40% reduction, scientists are clear that anything less than 60% will push the planet past catastrophic tipping points. The fossil fuel industry's fingerprints are all over this watered-down agreement, with lobbyists outnumbering climate scientists at the negotiations by a factor of four. Indigenous communities, who bear the least responsibility for climate change but suffer its worst effects, were once again marginalized in the process. We are running out of time for incremental steps—transformative change is the only rational response.",ENVIRONMENT,Lean Left,https://www.theguardian.com/environment/climate-radical-action,2024-01-17,climate_policy
Climate Agreement: A Diplomatic Achievement With Scientific Gaps,Bloomberg,"The climate agreement reached this week represents a significant diplomatic achievement but leaves a measurable gap between political ambition and scientific necessity. Markets responded positively to the deal's clean energy investment provisions, with renewable energy stocks rising 3.2% on average. However, analysts note that the 40% emission reduction target implies a global temperature increase of approximately 2.1°C—above the 1.5°C threshold that scientists identify as critical. The financial framework allocates $128 billion for developing nations' transitions, roughly 43% of what economists estimate is needed. Energy companies face increasing regulatory pressure as the agreement signals the direction of policy travel.",ENVIRONMENT,Lean Left,https://www.bloomberg.com/news/climate-diplomatic-scientific,2024-01-17,climate_policy
AI Reshaping the Job Market Faster Than Expected,CNN,"The artificial intelligence revolution is transforming the American workplace at a pace that has caught both workers and policymakers off guard. White-collar professionals in fields like law, finance, and marketing are finding their roles increasingly automated by AI tools. A new McKinsey report estimates that 30% of current work hours could be automated by 2030, displacing up to 12 million workers. Labor advocates are calling for robust retraining programs and safety-net expansions, while tech executives argue that AI will ultimately create more jobs than it destroys. The human toll is already visible in rising anxiety among office workers about their job security.",TECHNOLOGY,Lean Left,https://www.cnn.com/tech/ai-reshaping-job-market,2024-02-01,ai_jobs
AI Job Disruption Is Overhyped by Media Fearmongers,National Review,"The latest round of AI panic is a familiar pattern in the long history of technological progress. Every major innovation from the printing press to the internet has been accompanied by predictions of mass unemployment that never materialized. AI will certainly change some jobs, but it will also create entirely new categories of work that we cannot yet imagine. The market, not government planners, is the best mechanism for managing this transition. Heavy-handed regulations and taxpayer-funded retraining programs would only slow innovation and reduce American competitiveness. Workers have always adapted, and they will again.",TECHNOLOGY,Right,https://www.nationalreview.com/ai-job-disruption-overhyped,2024-02-01,ai_jobs
Study: AI Could Automate 30% of Work Hours by 2030,Associated Press,"A comprehensive analysis by McKinsey Global Institute estimates that artificial intelligence and automation could affect up to 30% of work hours in the US economy by 2030. The study examined 800 occupations across 45 categories and found that generative AI has significantly expanded the range of tasks susceptible to automation, particularly in knowledge work. Occupations with the highest exposure include data analysis, content creation, customer service, and administrative support. The report notes that while displacement is likely in some sectors, other areas such as healthcare, skilled trades, and AI development itself are expected to see job growth. Federal workforce development agencies are reviewing the findings.",TECHNOLOGY,Lean Left,https://www.apnews.com/technology/ai-automate-work-hours,2024-02-01,ai_jobs
"AI Is Coming for Your Job, and No One Is Preparing Workers",MSNBC,"The AI revolution is not a distant threat—it is already displacing workers across the economy, and the government's response has been woefully inadequate. While tech billionaires celebrate record profits from AI tools that replace human workers, displaced employees are left to navigate an underfunded and fragmented retraining system. The cruelty is the point: corporations adopt AI specifically to cut labor costs and weaken workers' bargaining power. We need bold federal action—a universal basic income pilot, massive investment in education, and regulations that require companies to share AI productivity gains with workers. Without intervention, AI will deepen inequality to unprecedented levels.",TECHNOLOGY,Left,https://www.msnbc.com/opinion/ai-coming-for-jobs,2024-02-01,ai_jobs
AI Workforce Transformation: Economic Impact Analysis,The Wall Street Journal,"The integration of artificial intelligence into the American economy presents both significant disruption risks and substantial productivity opportunities. Goldman Sachs estimates that AI could raise annual US GDP growth by 1.5 percentage points over the next decade, while simultaneously displacing workers in routine cognitive tasks. Companies reporting AI adoption have seen average productivity increases of 14% but have also reduced headcount in affected departments by an average of 8%. The labor market is likely to bifurcate, with high-skill AI-adjacent roles commanding premium wages while middle-skill positions face the most displacement pressure. Policy responses being discussed include tax incentives for retraining and adjustments to unemployment insurance.",TECHNOLOGY,Center,https://www.wsj.com/economy/ai-workforce-transformation,2024-02-01,ai_jobs
Healthcare Costs Continue to Rise Despite Reform Promises,The Washington Post,"American families are facing another year of rising healthcare costs, with new data showing that average out-of-pocket spending increased 12% over the past 12 months. The increases are hitting middle-class families hardest, with many reporting that they have delayed medical care due to cost concerns. Insurance premiums, deductibles, and prescription drug prices have all risen faster than wages. Healthcare policy experts point to the fragmented nature of the US healthcare system and the outsized influence of pharmaceutical and insurance lobbies as structural barriers to meaningful reform. The administration has proposed new measures to cap drug costs, but industry opposition remains fierce.",POLITICS,Lean Left,https://www.washingtonpost.com/health/costs-rising-reform,2024-01-18,healthcare_costs
"Free Market Reforms, Not Government Control, Will Fix Healthcare",The Blaze,"Healthcare costs are rising because of government interference in the market, not in spite of it. The Affordable Care Act loaded the system with mandates, regulations, and bureaucracy that drove up premiums and reduced choices for consumers. The solution is not more government control through single-payer schemes that would destroy innovation and create rationing. Instead, we need free-market reforms: allowing insurance sales across state lines, expanding health savings accounts, implementing price transparency requirements, and reducing the FDA's stranglehold on drug approvals. When consumers can shop for healthcare like any other service, competition will drive down prices naturally.",POLITICS,Right,https://www.theblaze.com/healthcare-free-market-reforms,2024-01-18,healthcare_costs
Rising Healthcare Costs Squeeze American Households,USA Today,"Healthcare spending by American families reached an average of $6,800 per person in 2023, up 12% from the previous year, according to new data from the Kaiser Family Foundation. The increase outpaced general inflation and wage growth for the fifth consecutive year. Prescription drug costs rose 15%, while insurance premiums increased 7% on average. Experts identify several contributing factors, including hospital consolidation, pharmaceutical pricing practices, administrative overhead, and an aging population requiring more intensive care. Both parties have proposed reforms but differ on approach, with Democrats favoring expanded government programs and Republicans advocating for market-based solutions.",POLITICS,Lean Left,https://www.usatoday.com/healthcare-costs-squeeze,2024-01-18,healthcare_costs
Medicare For All Is The Only Answer To America's Healthcare Crisis,Jacobin,"The latest healthcare cost data confirms what progressives have been saying for decades: the for-profit healthcare system is a moral catastrophe. While insurance company CEOs earn tens of millions in compensation, ordinary Americans are going bankrupt from medical bills or dying because they cannot afford treatment. The administrative waste in our multi-payer system consumes 34% of every healthcare dollar—money that goes to paperwork and profits rather than patient care. A single-payer Medicare for All system would eliminate this waste, cover every American, and reduce overall national healthcare spending. Every other wealthy nation provides universal healthcare at lower cost. The only thing standing in the way is corporate greed.",POLITICS,Left,https://www.jacobin.com/healthcare-medicare-for-all,2024-01-18,healthcare_costs
Healthcare Spending Data Shows Persistent Cost Pressures,Forbes,"New healthcare expenditure data reveals that cost pressures in the US healthcare system remain elevated despite various reform efforts. Total healthcare spending reached $4.5 trillion in 2023, representing 17.3% of GDP. Key drivers include pharmaceutical innovation costs, workforce shortages that increase labor expenses, technology adoption investments, and demographic shifts toward an older population. Hospital systems report operating margins averaging 2.8%, down from 4.1% pre-pandemic, suggesting that provider-side factors alone do not explain cost growth. Employer-sponsored insurance costs grew 7%, while individual market premiums varied significantly by state. The complex, multi-stakeholder nature of healthcare economics makes simple solutions elusive.",POLITICS,Center,https://www.forbes.com/healthcare-spending-cost-pressures,2024-01-18,healthcare_costs
