title,publisher,article_text,category,bias_label,url,published_date,topic_id
Congress Faces Showdown Over Federal Budget Priorities,HuffPost,"Lawmakers clashed over spending allocations as the deadline looms for a government funding deal, with defense and social program funding at the center of debate.",POLITICS,Left,https://www.huffpost.com/entry/congress-budget-battle_n_1001,2024-01-15,
Immigration Policy Overhaul Stalls Amid Partisan Divide,HuffPost,"A bipartisan immigration bill collapsed after last-minute opposition from hardliners on both sides, leaving millions of immigrants in legal limbo.",POLITICS,Left,https://www.huffpost.com/entry/immigration-policy-debate_n_1002,2024-01-16,
Global Climate Summit Yields Mixed Results On Emission Targets,HuffPost,World leaders agreed to new carbon reduction goals but critics say the targets fall far short of what scientists recommend to avert catastrophe.,POLITICS,Left,https://www.huffpost.com/entry/climate-summit-results_n_1003,2024-01-17,
Healthcare Costs Continue To Rise Despite Reform Promises,HuffPost,"New data shows that out-of-pocket healthcare spending has increased 12 percent over the past year, squeezing middle-class families the hardest.",POLITICS,Left,https://www.huffpost.com/entry/healthcare-costs-rising_n_1004,2024-01-18,
Gun Control Debate Reignites After Series Of Mass Shootings,HuffPost,Activists and lawmakers renew calls for stricter firearm regulations following a string of deadly shootings in multiple states.,POLITICS,Left,https://www.huffpost.com/entry/gun-control-debate_n_1005,2024-01-19,
Big Tech Faces Tough Questions In Antitrust Hearings,HuffPost,"CEOs of major tech companies testified before Congress about market dominance, data privacy concerns, and their impact on small businesses.",POLITICS,Left,https://www.huffpost.com/entry/tech-antitrust-hearings_n_1006,2024-01-20,
Election Security Measures Ramp Up Ahead Of 2024 Primaries,HuffPost,Federal and state officials announce enhanced cybersecurity protocols and paper ballot backups to protect the integrity of upcoming elections.,POLITICS,Left,https://www.huffpost.com/entry/election-security-2024_n_1007,2024-01-21,
Fight For Higher Minimum Wage Gains Momentum In Several States,HuffPost,Workers and advocacy groups push for a $20 federal minimum wage as cost of living continues to outpace entry-level earnings across the country.,POLITICS,Left,https://www.huffpost.com/entry/minimum-wage-fight_n_1008,2024-01-22,
Supreme Court Rulings Signal Shift On Executive Power Limits,HuffPost,"A series of recent decisions have curtailed federal agency authority, raising questions about the future of environmental and financial regulations.",POLITICS,Left,https://www.huffpost.com/entry/supreme-court-rulings_n_1009,2024-01-23,
Education Funding Disparities Widen Between Wealthy And Poor Districts,HuffPost,A new report reveals that per-student spending in affluent school districts is nearly three times higher than in low-income communities.,POLITICS,Left,https://www.huffpost.com/entry/education-funding-gaps_n_1010,2024-01-24,
AI Is Reshaping The Job Market Faster Than Expected,HuffPost,"Automation and AI tools are displacing white-collar jobs at an unprecedented rate, prompting calls for retraining programs and policy intervention.",TECHNOLOGY,Left,https://www.huffpost.com/entry/ai-job-displacement_n_2001,2024-02-01,
New Study Links Social Media Use To Rising Teen Anxiety,HuffPost,Researchers found that teens spending more than three hours daily on social platforms showed significantly higher rates of anxiety and depression symptoms.,TECHNOLOGY,Left,https://www.huffpost.com/entry/social-media-mental-health_n_2002,2024-02-02,
Electric Vehicle Charging Network Expansion Hits Roadblocks,HuffPost,"Despite billions in federal funding, the rollout of EV charging stations has been slower than planned due to permitting delays and supply chain issues.",TECHNOLOGY,Left,https://www.huffpost.com/entry/ev-charging-infrastructure_n_2003,2024-02-03,
Bipartisan Data Privacy Bill Finally Advances In Congress,HuffPost,"After years of failed attempts, a comprehensive federal data privacy law moves forward with support from both parties and cautious approval from tech firms.",TECHNOLOGY,Left,https://www.huffpost.com/entry/data-privacy-legislation_n_2004,2024-02-04,
Quantum Computing Breakthrough Could Transform Drug Discovery,HuffPost,"Scientists demonstrate a quantum computer solving molecular simulations that would take classical computers thousands of years, opening doors for pharmaceutical research.",TECHNOLOGY,Left,https://www.huffpost.com/entry/quantum-computing-milestone_n_2005,2024-02-05,
Remote Work Revolution Shows No Signs Of Slowing Down,HuffPost,"Despite corporate pushes for return-to-office mandates, survey data shows a majority of knowledge workers prefer hybrid or fully remote arrangements.",BUSINESS,Left,https://www.huffpost.com/entry/remote-work-trend_n_3001,2024-02-10,
Housing Affordability Crisis Deepens Across Major US Cities,HuffPost,"Median home prices have reached record highs in 40 metropolitan areas while wages stagnate, pushing homeownership further out of reach for younger generations.",BUSINESS,Left,https://www.huffpost.com/entry/housing-market-crisis_n_3002,2024-02-11,
Grocery Prices Remain Stubbornly High Despite Cooling Inflation,HuffPost,"While overall inflation has moderated, food prices at the supermarket continue to strain household budgets, with staples like eggs and meat still elevated.",BUSINESS,Left,https://www.huffpost.com/entry/inflation-grocery-prices_n_3003,2024-02-12,
Small Business Closures Hit Pandemic-Era Highs In Several Sectors,HuffPost,"Restaurants, retail shops, and local services are shuttering at alarming rates as high interest rates and reduced consumer spending take their toll.",BUSINESS,Left,https://www.huffpost.com/entry/small-business-closures_n_3004,2024-02-13,
Student Loan Repayments Resume With New Income-Driven Plans,HuffPost,"Millions of borrowers begin making payments again under revised repayment structures, though confusion about eligibility and enrollment persists.",BUSINESS,Left,https://www.huffpost.com/entry/student-loan-repayment_n_3005,2024-02-14,
Employers Expand Mental Health Benefits To Combat Burnout,HuffPost,"More companies are adding therapy stipends, mental health days, and wellness apps to benefit packages as employee burnout reaches critical levels.",WELLNESS,Left,https://www.huffpost.com/entry/mental-health-workplace_n_4001,2024-02-20,
Even 10 Minutes Of Daily Exercise Can Add Years To Your Life,HuffPost,"A large-scale study confirms that minimal daily physical activity significantly reduces mortality risk, challenging the notion that intense workouts are necessary.",WELLNESS,Left,https://www.huffpost.com/entry/exercise-longevity-study_n_4002,2024-02-21,
America Is In The Grip Of A Sleep Deprivation Epidemic,HuffPost,"CDC data reveals that more than a third of US adults regularly get less than seven hours of sleep, contributing to chronic disease and reduced productivity.",WELLNESS,Left,https://www.huffpost.com/entry/sleep-deprivation-epidemic_n_4003,2024-02-22,
Ultra-Processed Foods Linked To Higher Cancer Risk In New Study,HuffPost,Research published in a leading medical journal shows a strong correlation between diets high in ultra-processed foods and increased rates of colorectal cancer.,WELLNESS,Left,https://www.huffpost.com/entry/ultra-processed-foods_n_4004,2024-02-23,
Schools Adopting Meditation Programs See Drop In Student Suspensions,HuffPost,Pilot programs introducing mindfulness and meditation into public schools report significant reductions in disciplinary issues and improved academic focus.,WELLNESS,Left,https://www.huffpost.com/entry/meditation-schools_n_4005,2024-02-24,
Streaming Wars Intensify As Platforms Hike Prices Again,HuffPost,"Major streaming services announce another round of price increases while simultaneously cracking down on password sharing, testing consumer loyalty.",ENTERTAINMENT,Left,https://www.huffpost.com/entry/streaming-wars-2024_n_5001,2024-03-01,
Oscar Nominations Spark Fresh Debate Over Diversity In Hollywood,HuffPost,This year's Academy Award nominations once again highlight the gap between inclusion pledges and actual representation in major film categories.,ENTERTAINMENT,Left,https://www.huffpost.com/entry/oscars-diversity_n_5002,2024-03-02,
AI-Generated Music Raises Thorny Copyright Questions,HuffPost,"As AI tools capable of producing songs in the style of famous artists proliferate, the music industry grapples with how to protect intellectual property rights.",ENTERTAINMENT,Left,https://www.huffpost.com/entry/music-ai-copyright_n_5003,2024-03-03,
2024 On Track To Be Hottest Year Ever Recorded,HuffPost,Global temperature records continue to fall as scientists warn that climate change is accelerating faster than most models predicted.,ENVIRONMENT,Left,https://www.huffpost.com/entry/climate-extreme-weather_n_6001,2024-03-10,
Microplastics Found In Every Ocean And Most Freshwater Sources,HuffPost,"A comprehensive study reveals the staggering extent of microplastic contamination in global water systems, with potential implications for human health.",ENVIRONMENT,Left,https://www.huffpost.com/entry/ocean-pollution-crisis_n_6002,2024-03-11,
Renewable Energy Surpasses Coal In US Power Generation For First Time,HuffPost,"Wind and solar combined now produce more electricity than coal plants in the US, marking a historic milestone in the energy transition.",ENVIRONMENT,Left,https://www.huffpost.com/entry/renewable-energy-growth_n_6003,2024-03-12,
Popular Tourist Destinations Fight Back Against Overtourism,HuffPost,"Cities like Venice, Barcelona, and Kyoto implement visitor caps and entry fees to protect local communities and historic sites from tourism overload.",TRAVEL,Left,https://www.huffpost.com/entry/travel-overtourism_n_7001,2024-03-15,
New Rules Give Air Passengers Automatic Refunds For Delays,HuffPost,Federal regulations now require airlines to automatically refund passengers for significant delays and cancellations without requiring them to file claims.,TRAVEL,Left,https://www.huffpost.com/entry/airline-passenger-rights_n_7002,2024-03-16,
Foreign Disinformation Campaigns Target US Elections On Social Media,HuffPost,Intelligence agencies identify coordinated campaigns from foreign actors using AI-generated content to sow political division ahead of elections.,POLITICS,Left,https://www.huffpost.com/entry/election-misinformation_n_1011,2024-03-20,
Tax Reform Proposals Divide Parties As Deficit Concerns Mount,HuffPost,"Democrats push for higher corporate taxes while Republicans advocate for extending individual tax cuts, as the national debt approaches record levels.",POLITICS,Left,https://www.huffpost.com/entry/tax-reform-debate_n_1012,2024-03-21,
Police Reform Measures Show Uneven Progress Across The Country,HuffPost,"While some cities have implemented significant changes to policing practices, many departments remain largely unreformed years after national protests.",POLITICS,Left,https://www.huffpost.com/entry/police-reform-progress_n_1013,2024-03-22,
Veterans Mental Health Crisis Worsens Despite Increased Funding,HuffPost,Suicide rates among military veterans remain alarmingly high even as the VA expands access to counseling and crisis services.,POLITICS,Left,https://www.huffpost.com/entry/veterans-mental-health_n_1014,2024-03-23,
Childcare Costs Now Exceed College Tuition In Many States,HuffPost,"Families across the country spend an average of $15,000 per year on childcare, forcing many parents to reduce work hours or leave the workforce entirely.",POLITICS,Left,https://www.huffpost.com/entry/childcare-costs_n_1015,2024-03-24,
Cryptocurrency Markets Face New Wave Of Regulatory Scrutiny,HuffPost,SEC enforcement actions and proposed legislation aim to bring digital assets under tighter oversight after a series of high-profile exchange collapses.,TECHNOLOGY,Left,https://www.huffpost.com/entry/crypto-regulation_n_2006,2024-03-25,
Gene Therapy Advances Offer Hope For Previously Untreatable Diseases,HuffPost,"New gene editing treatments show remarkable results in clinical trials for sickle cell disease and certain forms of blindness, though costs remain prohibitive.",TECHNOLOGY,Left,https://www.huffpost.com/entry/biotech-gene-therapy_n_2007,2024-03-26,
Gig Workers Win Major Labor Rights Victory In Court Ruling,HuffPost,"A federal appeals court rules that delivery and rideshare drivers must be classified as employees, potentially upending the business models of major platforms.",BUSINESS,Left,https://www.huffpost.com/entry/gig-economy-labor-rights_n_3006,2024-03-27,
Regional Bank Failures Raise Questions About Financial System Stability,HuffPost,Two more mid-size banks are seized by regulators as rising interest rates continue to erode the value of their bond holdings and deposit bases.,BUSINESS,Left,https://www.huffpost.com/entry/bank-failures-concern_n_3007,2024-03-28,
Vaccine Hesitancy Grows As New Respiratory Virus Spreads,HuffPost,Public health officials struggle to combat misinformation about a newly developed vaccine as a novel respiratory illness gains traction in several regions.,WELLNESS,Left,https://www.huffpost.com/entry/vaccine-hesitancy_n_4006,2024-03-29,
Wildfire Season Arrives Months Early In Western United States,HuffPost,"Record-low snowpack and dry conditions have led to an unusually early and intense start to wildfire season, straining firefighting resources.",ENVIRONMENT,Left,https://www.huffpost.com/entry/wildfire-season-early_n_6004,2024-03-30,
Space Tourism Takes Next Step With Orbital Hotel Plans,HuffPost,"Private space companies announce plans for a commercial space station that would host tourists by 2028, though safety and cost concerns remain.",TECHNOLOGY,Left,https://www.huffpost.com/entry/space-tourism-advances_n_2008,2024-04-01,
Labor Union Membership Surges Among Young Workers,HuffPost,"Unionization drives at coffee shops, warehouses, and tech companies signal a generational shift in attitudes toward organized labor.",BUSINESS,Left,https://www.huffpost.com/entry/union-membership-surge_n_3008,2024-04-02,
Book Ban Efforts Reach Record Levels Across US Libraries,HuffPost,"Attempts to remove books from public and school libraries hit an all-time high, with challenges increasingly targeting works by LGBTQ+ authors and authors of color.",ENTERTAINMENT,Left,https://www.huffpost.com/entry/book-bans-libraries_n_5004,2024-04-03,
Southwest Water Crisis Forces Unprecedented Conservation Measures,HuffPost,"Arizona and Nevada implement strict water usage limits as Colorado River levels continue to decline, threatening agriculture and urban water supplies.",ENVIRONMENT,Left,https://www.huffpost.com/entry/water-scarcity-southwest_n_6005,2024-04-04,
US Allies Question American Commitment To Global Security Partnerships,HuffPost,NATO members and Indo-Pacific allies express growing uncertainty about the reliability of US defense commitments amid shifting domestic political priorities.,POLITICS,Left,https://www.huffpost.com/entry/foreign-policy-alliances_n_1016,2024-04-05,
Congress Faces Showdown Over Federal Budget Priorities,CNN,Congressional Democrats and Republicans are locked in a bitter fight over federal spending. Democrats argue that slashing social safety-net programs would devastate working families already struggling with inflation. They point to data showing that programs like SNAP and Medicaid lifted millions out of poverty last year. Republican leaders counter that runaway government spending is the root cause of inflation and insist on significant cuts to non-defense discretionary spending. The White House has signaled willingness to negotiate but maintains that cuts to education and healthcare are non-starters.,POLITICS,Lean Left,https://www.cnn.com/politics/budget-showdown-2024,2024-01-15,budget_2024
Budget Battle: Republicans Push for Fiscal Responsibility,Fox News,"House Republicans are standing firm on their demand for significant spending cuts as a condition for raising the debt ceiling. Speaker-led negotiations center on reducing bloated government programs that critics say have created dependency rather than opportunity. The GOP plan would cap discretionary spending at 2022 levels, saving taxpayers an estimated $150 billion over the next decade. Democrats have refused meaningful negotiations, instead pushing for more spending that would add trillions to the national debt. Economic analysts warn that without fiscal discipline, the country faces a debt crisis.",POLITICS,Right,https://www.foxnews.com/politics/budget-republicans-fiscal,2024-01-15,budget_2024
Federal Budget Negotiations Enter Critical Phase,Reuters,"Negotiations over the federal budget entered a critical phase on Monday as the deadline for a government funding agreement approaches. Both parties have staked out positions, with Democrats seeking to preserve social program funding and Republicans pushing for spending reductions. The current proposal would affect approximately 800 discretionary programs across multiple federal agencies. Congressional Budget Office estimates suggest a potential 4.3% reduction in non-defense spending under the Republican proposal, while the Democratic alternative would increase spending by 2.1% above current levels. Markets showed modest volatility as investors monitored the developments.",POLITICS,Center,https://www.reuters.com/world/us/budget-negotiations-critical,2024-01-15,budget_2024
Budget Fight Exposes America's Broken Priorities,HuffPost,"The latest budget fight in Congress reveals a disturbing truth about American priorities: lawmakers are willing to let children go hungry to preserve tax breaks for corporations. While Republicans demand austerity for programs that feed school children and provide healthcare to the elderly, they remain silent about the $800 billion defense budget and billions in fossil fuel subsidies. Progressive lawmakers have pushed back, arguing that a moral budget would invest in people, not Pentagon contractors. The real question is whether Congress serves working Americans or its wealthy donors.",POLITICS,Left,https://www.huffpost.com/entry/budget-broken-priorities,2024-01-15,budget_2024
Reckless Spending Must Stop: The Case for Budget Discipline,Daily Wire,"The federal government is on an unsustainable spending trajectory, and only serious fiscal conservatives seem willing to do anything about it. The national debt has surpassed $34 trillion, a staggering burden that future generations will inherit. Yet Democrats continue to push for expanded entitlement programs and Green New Deal-style spending that the country simply cannot afford. Every dollar the government borrows is a dollar taken from productive private-sector investment. The Republican budget proposal represents a common-sense return to fiscal sanity that prioritizes economic growth over government dependency.",POLITICS,Right,https://www.dailywire.com/budget-discipline-case,2024-01-15,budget_2024
Budget Dispute: Both Sides Dig In As Shutdown Looms,The Hill,"The prospect of a government shutdown grew more likely on Monday as both parties hardened their positions on federal spending. Republican negotiators are pushing for a top-line spending cut of roughly 8% from current levels, while Democrats are insisting on at least maintaining current funding for domestic programs. A bipartisan group of centrist senators has proposed a compromise that would freeze spending at current levels while establishing a commission to address long-term fiscal challenges. Leadership on both sides has yet to endorse the centrist plan. Federal employees have been advised to prepare for a potential lapse in funding.",POLITICS,Center,https://www.thehill.com/policy/budget-shutdown-looms,2024-01-15,budget_2024
Immigration Overhaul Collapses Amid Partisan Gridlock,The New York Times,"A bipartisan immigration deal years in the making fell apart on Tuesday after conservatives rejected the compromise as insufficient and progressives criticized its enforcement provisions as inhumane. The proposal would have provided a pathway to legal status for Dreamers while increasing border security funding by $14 billion. Immigration advocacy groups expressed disappointment, noting that millions of undocumented immigrants who have lived in the US for decades continue to face uncertainty. Policy experts warn that the failure makes comprehensive reform increasingly unlikely before the next election.",POLITICS,Lean Left,https://www.nytimes.com/politics/immigration-overhaul-collapse,2024-01-16,immigration_reform
Border Crisis Deepens as Democrats Block Security Measures,Fox News,"The crisis at the southern border continues to spiral out of control as Democrats refuse to support meaningful border security measures. Border Patrol agents have encountered over 300,000 migrants in the past month alone, overwhelming detention facilities and border communities. The rejected bipartisan deal would have done little to stem the tide, with loopholes that critics say would have allowed continued mass migration. Republican governors have renewed their calls for the federal government to enforce existing immigration laws and complete the border wall. Meanwhile, fentanyl seizures at the border have reached record levels.",POLITICS,Right,https://www.foxnews.com/politics/border-crisis-deepens,2024-01-16,immigration_reform
Immigration Bill Failure Leaves Millions in Uncertainty,NPR,"The collapse of bipartisan immigration legislation has left approximately 11 million undocumented immigrants in continued legal limbo. The bill, which was negotiated over 18 months, represented the most significant attempt at immigration reform since 2013. It included provisions for enhanced border technology, increased immigration court funding, and a conditional pathway for long-term residents. Both conservative and progressive critics found fault with the compromise, illustrating the difficulty of threading the political needle on immigration. Community organizations are now focusing on state-level protections as a federal solution appears increasingly remote.",POLITICS,Lean Left,https://www.npr.org/politics/immigration-bill-failure,2024-01-16,immigration_reform
America's Immigration System Is Cruel By Design,Vox,"The failure of yet another immigration bill is not a bug in the system—it's a feature. America's immigration apparatus has been deliberately constructed to maximize human suffering while providing a convenient political football for both parties. The real victims are the families torn apart by deportation, the Dreamers who know no other country, and the asylum seekers fleeing violence who are treated as criminals. Any honest reckoning with immigration must start by acknowledging that the current system serves political interests, not human needs. What we need is not incremental reform but a fundamental reimagining of how we welcome newcomers.",POLITICS,Left,https://www.vox.com/policy/immigration-system-cruel,2024-01-16,immigration_reform
"Immigration Deal Falls Short on Enforcement, Critics Say",Washington Examiner,"Conservative critics of the failed immigration compromise say it would have done more harm than good by effectively legalizing millions of people who entered the country illegally. The deal's enforcement provisions were widely regarded as inadequate by border hawks, who noted that similar promises in past legislation were never fully implemented. Heritage Foundation analysts estimated that the bill would have increased net immigration by 1.3 million people per year. With the deal dead, attention turns to executive actions that the administration might pursue, which conservatives have vowed to challenge in court.",POLITICS,Lean Right,https://www.washingtonexaminer.com/immigration-enforcement-critics,2024-01-16,immigration_reform
"Bipartisan Immigration Effort Collapses, Both Sides Share Blame",Associated Press,"A bipartisan effort to overhaul US immigration policy collapsed Tuesday after months of negotiations failed to produce a compromise acceptable to both parties. The proposed legislation included $14.3 billion for border security, a new asylum processing system, and conditional legal status for some long-term undocumented residents. Supporters from both parties expressed frustration that political calculations outweighed policy considerations. Senate negotiators from the bipartisan group said they would continue informal discussions but acknowledged that an election year makes progress difficult. The current immigration system processes approximately 2 million cases annually with a backlog exceeding 3 million.",POLITICS,Lean Left,https://www.apnews.com/immigration-effort-collapses,2024-01-16,immigration_reform
Climate Summit Yields Mixed Results on Emission Targets,The Washington Post,"World leaders concluded a major climate summit with new pledges to reduce carbon emissions, but environmental groups say the commitments fall dangerously short of what science demands. The agreement calls for a 40% reduction in greenhouse gas emissions by 2035, compared to the 60% that leading climate scientists say is necessary to limit warming to 1.5 degrees Celsius. Developing nations expressed frustration at the lack of concrete financial commitments from wealthy countries to support their clean energy transitions. The US delegation touted the agreement as a step forward while acknowledging more work is needed.",ENVIRONMENT,Lean Left,https://www.washingtonpost.com/climate/summit-mixed-results,2024-01-17,climate_policy
